{
  "apiVersion": "packs.flightdeck.dev/v1",
  "kind": "PackIndex",
  "generated": "2026-06-14T00:00:00Z",
  "entries": [
    {
      "name": "flightdeck/hello-pack",
      "version": "0.1.0",
      "ref": "oci://ghcr.io/snowops/hello-pack:0.1.0",
      "publisher": "flightdeck",
      "displayName": "Hello Pack",
      "description": "A minimal example pack with one scenario — the reference for authors.",
      "license": "Apache-2.0",
      "tier": "community",
      "keywords": ["example", "getting-started"],
      "categories": ["tutorial"],
      "verified": true
    }
  ]
}
